{
  "id": "extract_20260410_125224",
  "created_at": "2026-04-10T12:52:24",
  "source": "C:\\NexusV3\\generated\\source_intake_selftest",
  "subsystem": "selftest_sources",
  "classification": "ADOPT",
  "rationale": "No medium/high risks detected.",
  "findings": [],
  "staging_path": "C:\\NexusV3\\generated\\staging\\selftest_sources\\extract_20260410_125224"
}
